{
  "$schema": "http://json-schema.org/draft-07/schema#",
  "$id": "site-spec.schema.json",
  "title": "Site Specification",
  "description": "Schema for site-spec.json — the single source of truth that the Architect produces and the Builder consumes to generate the Astro website.",
  "type": "object",
  "additionalProperties": false,
  "required": ["meta", "brand", "site", "pages"],
  "properties": {
    "$schema": {
      "type": "string",
      "description": "Optional self-referencing JSON Schema URI so editors can validate site-spec.json automatically."
    },
    "meta": {
      "type": "object",
      "description": "Metadata about the specification itself: who it is for, which version, and when it was created or updated. Required so the Orchestrator can track iterations.",
      "additionalProperties": false,
      "required": ["clientName"],
      "properties": {
        "clientName": {
          "type": "string",
          "description": "Human-readable name of the client or business. Used in headings, logs, and eject handoff."
        },
        "version": {
          "type": "string",
          "description": "Semver or iteration label of this spec. Helps the Orchestrator detect drift between spec and build."
        },
        "createdAt": {
          "type": "string",
          "format": "date-time",
          "description": "ISO-8601 timestamp of first creation. Used for audit trail and client reporting."
        },
        "updatedAt": {
          "type": "string",
          "format": "date-time",
          "description": "ISO-8601 timestamp of last modification. Lets the Orchestrator know if the spec changed since last build."
        },
        "approvedAt": {
          "type": "string",
          "format": "date-time",
          "description": "ISO-8601 timestamp when the user explicitly approved this spec. The Builder verifies this before starting work. Stamped by the Architect after the Orchestrator confirms the approval gate."
        }
      }
    },
    "brand": {
      "type": "object",
      "description": "Visual identity of the business. Drives Tailwind config, component theming, and favicon selection.",
      "additionalProperties": false,
      "required": ["name"],
      "properties": {
        "name": {
          "type": "string",
          "description": "Official brand name. Used as default alt text, <title> fallback, and footer credit."
        },
        "tagline": {
          "type": "string",
          "description": "Short brand slogan displayed in the hero and metadata descriptions."
        },
        "colors": {
          "type": "object",
          "description": "Brand color palette mapped to Tailwind CSS custom properties. Each value must be a 6-digit hex code.",
          "additionalProperties": false,
          "properties": {
            "primary": {
              "type": "string",
              "pattern": "^#[0-9A-Fa-f]{6}$",
              "description": "Main brand color used for CTAs, links, and key UI elements."
            },
            "secondary": {
              "type": "string",
              "pattern": "^#[0-9A-Fa-f]{6}$",
              "description": "Supporting color for secondary actions, accents, and hover states."
            },
            "accent": {
              "type": "string",
              "pattern": "^#[0-9A-Fa-f]{6}$",
              "description": "Highlight color for badges, notifications, and emphasis elements."
            },
            "background": {
              "type": "string",
              "pattern": "^#[0-9A-Fa-f]{6}$",
              "description": "Default page background color. Sets the base canvas for all sections."
            },
            "text": {
              "type": "string",
              "pattern": "^#[0-9A-Fa-f]{6}$",
              "description": "Default body text color. Must meet WCAG contrast against the background."
            }
          }
        },
        "typography": {
          "type": "object",
          "description": "Font configuration for headings and body text. Maps to @font-face imports and Tailwind font-family utilities.",
          "additionalProperties": false,
          "properties": {
            "heading": {
              "type": "string",
              "description": "Font family for h1–h6 elements. Typically a display or serif font."
            },
            "body": {
              "type": "string",
              "description": "Font family for paragraphs and UI text. Typically a sans-serif for readability."
            }
          }
        },
        "logo": {
          "type": "object",
          "description": "Logo asset references. Used in the header, footer, and as the OG image fallback.",
          "additionalProperties": false,
          "properties": {
            "src": {
              "type": "string",
              "description": "Path or URL to the primary logo (light background variant)."
            },
            "dark": {
              "type": "string",
              "description": "Optional path or URL to a dark-mode variant of the logo."
            }
          }
        }
      }
    },
    "site": {
      "type": "object",
      "description": "Site-wide configuration that affects routing, SEO, localization, and deployment targets.",
      "additionalProperties": false,
      "properties": {
        "domain": {
          "type": "string",
          "description": "Production domain (e.g. example.com). Used to build canonical URLs and sitemap entries."
        },
        "language": {
          "type": "string",
          "default": "es",
          "description": "ISO 639-1 language code. Sets the HTML lang attribute and influences SEO hreflang tags."
        },
        "defaultTitle": {
          "type": "string",
          "description": "Fallback <title> used on pages that do not define their own title."
        },
        "defaultDescription": {
          "type": "string",
          "description": "Fallback meta description used on pages that do not define their own description."
        },
        "favicon": {
          "type": "string",
          "description": "Path to the favicon file. Injected into the <head> of every page by the SEO component."
        },
        "social": {
          "type": "object",
          "description": "Social media / network links (RRSS) for the business. Each value is the full profile URL. Used in the footer and contact section.",
          "additionalProperties": false,
          "properties": {
            "instagram": { "type": "string", "description": "Instagram profile URL." },
            "facebook": { "type": "string", "description": "Facebook page URL." },
            "x": { "type": "string", "description": "X (Twitter) profile URL." },
            "linkedin": { "type": "string", "description": "LinkedIn company/profile URL." },
            "youtube": { "type": "string", "description": "YouTube channel URL." },
            "tiktok": { "type": "string", "description": "TikTok profile URL." },
            "whatsapp": { "type": "string", "description": "WhatsApp contact link (e.g. https://wa.me/<number>)." },
            "github": { "type": "string", "description": "GitHub profile/org URL." }
          }
        },
        "contact": {
          "type": "object",
          "description": "Actual contact data for the business. These values are stored as environment variables (PUBLIC_CONTACT_EMAIL, PUBLIC_CONTACT_PHONE, PUBLIC_MAPS_EMBED_URL) in the Astro project, never in the harness. The Architect extracts them from the client during intake.",
          "additionalProperties": false,
          "properties": {
            "email": {
              "type": "string",
              "format": "email",
              "description": "Primary contact email address. Rendered as mailto: link. Stored as PUBLIC_CONTACT_EMAIL env var."
            },
            "phone": {
              "type": "string",
              "description": "Contact phone number (E.164 format preferred, e.g. +56912345678). Rendered as tel: link. Stored as PUBLIC_CONTACT_PHONE env var."
            },
            "address": {
              "type": "string",
              "description": "Physical address displayed in the contact section. Not geocoded by the harness; shown as-is."
            },
            "mapsEmbedUrl": {
              "type": "string",
              "format": "uri",
              "description": "Google Maps embed URL (iframe src) for the business location. Stored as PUBLIC_MAPS_EMBED_URL env var. Obtained from Google Maps > Share > Embed a map."
            }
          }
        }
      }
    },
    "pages": {
      "type": "array",
      "description": "Ordered list of pages to generate. Each entry becomes a .astro file in src/pages/ and a route in the static output.",
      "items": {
        "type": "object",
        "additionalProperties": false,
        "required": ["route"],
        "properties": {
          "route": {
            "type": "string",
            "pattern": "^/",
            "description": "URL path for this page, must start with /. Determines the output file location in src/pages/."
          },
          "title": {
            "type": "string",
            "description": "Page-specific <title> override. Falls back to site.defaultTitle if omitted."
          },
          "description": {
            "type": "string",
            "description": "Page-specific meta description. Falls back to site.defaultDescription if omitted."
          },
          "hero": {
            "type": "object",
            "description": "Hero section configuration for the page. Controls the above-the-fold content: heading, subheading, CTA, and background.",
            "additionalProperties": true
          },
          "sections": {
            "type": "array",
            "description": "Ordered list of content sections to render below the hero. Each item defines a component block.",
            "items": {
              "type": "object",
              "additionalProperties": true
            }
          }
        }
      }
    },
    "features": {
      "type": "object",
      "description": "Toggleable platform features. Controls which integrations are wired up during the build.",
      "additionalProperties": false,
      "properties": {
        "gtm_id": {
          "type": "string",
          "pattern": "^GTM-[A-Z0-9]+$",
          "description": "Google Tag Manager container ID. When present, injected as PUBLIC_GTM_ID env var and loaded in the SEO component."
        },
        "ga4_id": {
          "type": "string",
          "pattern": "^G-[A-Z0-9]+$",
          "description": "Google Analytics 4 measurement ID. When present, injected as PUBLIC_GA4_ID env var. The template handles dual-tracking with GTM without duplicating pageviews."
        },
        "has_contact_form": {
          "type": "boolean",
          "description": "Whether to generate a functional contact form page. If false, only static contact info is shown."
        },
        "contact_channels": {
          "type": "object",
          "description": "Which contact channels to display on the contact section/page. Each boolean toggles a specific channel UI. The actual values (email, phone, etc.) come from site.contact.",
          "additionalProperties": false,
          "properties": {
            "email": {
              "type": "boolean",
              "description": "Show email contact link (mailto:). Uses site.contact.email."
            },
            "phone": {
              "type": "boolean",
              "description": "Show phone number link (tel:). Uses site.contact.phone."
            },
            "whatsapp": {
              "type": "boolean",
              "description": "Show WhatsApp chat link (wa.me/). Uses site.social.whatsapp."
            },
            "map": {
              "type": "boolean",
              "description": "Show embedded map (Google Maps iframe). Uses site.contact.mapsEmbedUrl."
            }
          }
        },
        "dark_mode": {
          "type": "boolean",
          "description": "Enable dark mode toggle. When true, Tailwind dark: variants and a theme switcher are included."
        },
        "i18n": {
          "type": "object",
          "description": "Internationalization configuration. Controls multi-language routing and content negotiation.",
          "additionalProperties": false,
          "properties": {
            "enabled": {
              "type": "boolean",
              "description": "Whether i18n routing is active. When true, pages are generated under /<locale>/ prefixes."
            },
            "defaultLocale": {
              "type": "string",
              "description": "Default locale used when no prefix is present in the URL."
            },
            "locales": {
              "type": "array",
              "description": "List of supported locale codes. Each generates a routed subdirectory when i18n is enabled.",
              "items": {
                "type": "string"
              }
            }
          }
        }
      }
    },
    "seo": {
      "type": "object",
      "description": "Global SEO defaults passed as props to the immutable SEO.astro component.",
      "additionalProperties": false,
      "properties": {
        "defaultImage": {
          "type": "string",
          "description": "Path or URL to the default Open Graph / Twitter card image used when a page does not define its own."
        },
        "robots": {
          "type": "string",
          "description": "Custom robots meta content (e.g. 'index, follow'). Overrides the default for all pages."
        }
      }
    },
    "content_collections": {
      "type": "object",
      "description": "Keystatic CMS content collection definitions for Fase 2. Each key is a collection name; the value defines its schema and fields. Kept open to allow arbitrary collection shapes.",
      "additionalProperties": {
        "type": "object",
        "description": "A single content collection definition. Name is derived from the object key.",
        "additionalProperties": true
      }
    }
  }
}
